{
  "$schema": "https://json-schema.org/draft/2020-12/schema",
  "$id": "urn:agentic:example:entry:0.1",
  "title": "Entry envelope",
  "description": "One shape for all four entries (T-t6-02). kind says which entry produced it; nothing downstream branches on it. Identity, correlation, budget ceiling and idempotency key are required on every envelope because the platform applies those concerns rather than the caller requesting them (F-b4-01).",
  "type": "object",
  "additionalProperties": false,
  "required": ["envelope_version", "kind", "entry_id", "occurred_at", "actor", "intent", "correlation", "budget", "idempotency_key", "payload"],
  "properties": {
    "envelope_version": {"const": "0.1"},
    "kind": {
      "enum": ["human", "event", "schedule", "external"],
      "description": "human: a person acts. event: something happened. schedule: a recurrence rule fired. external: another system or agent submitted work."
    },
    "entry_id": {"type": "string", "pattern": "^[a-z0-9][a-z0-9-]{2,63}$"},
    "occurred_at": {"type": "string", "pattern": "^[0-9]{4}-[0-9]{2}-[0-9]{2}T[0-9]{2}:[0-9]{2}:[0-9]{2}Z$"},
    "actor": {
      "type": "object",
      "additionalProperties": false,
      "required": ["subject", "delegation_chain"],
      "description": "Every action names an actor, including delegated agent actors, and the delegation chain is explicit (F-b4-03).",
      "properties": {
        "subject": {"type": "string", "pattern": "^(user|service|agent|schedule):[a-z0-9][a-z0-9._@-]*$"},
        "delegation_chain": {
          "type": "array",
          "minItems": 1,
          "items": {
            "type": "object",
            "additionalProperties": false,
            "required": ["actor", "obtained_via"],
            "properties": {
              "actor": {"type": "string"},
              "obtained_via": {"enum": ["direct", "token_exchange", "workload_attestation"]}
            }
          }
        }
      }
    },
    "intent": {
      "type": "object",
      "additionalProperties": false,
      "required": ["workflow_ref", "summary"],
      "description": "What to run and why. workflow_ref is the declared unit of work; document_ref points at a longer declaration when one exists.",
      "properties": {
        "workflow_ref": {"type": "string", "minLength": 1},
        "document_ref": {"type": "string"},
        "summary": {"type": "string", "minLength": 1, "maxLength": 400}
      }
    },
    "correlation": {
      "type": "object",
      "additionalProperties": false,
      "required": ["run_id", "correlation_id"],
      "description": "Correlation rides on explicit attributes set at entry, never on trace parentage (F-b4-06).",
      "properties": {
        "run_id": {"type": "string", "minLength": 1},
        "correlation_id": {"type": "string", "minLength": 1},
        "parent_correlation_id": {"type": "string"},
        "depth": {"type": "integer", "minimum": 0}
      }
    },
    "budget": {
      "type": "object",
      "additionalProperties": false,
      "required": ["ceiling_micros", "currency", "on_exceed"],
      "description": "Exceeding the ceiling terminates the unit, not the platform; on_exceed is a const so no caller can opt out (F-b4-02).",
      "properties": {
        "ceiling_micros": {"type": "integer", "minimum": 0},
        "currency": {"type": "string", "pattern": "^[A-Z]{3}$"},
        "on_exceed": {"const": "terminate_unit"}
      }
    },
    "idempotency_key": {
      "type": "string",
      "minLength": 8,
      "maxLength": 255,
      "description": "Every externally-triggered action is safe to replay (F-b4-08). Same key plus same body is a no-op; same key plus a different body is a conflict."
    },
    "payload": {
      "type": "object",
      "description": "Entry-specific body. Nothing downstream of intake parses it by entry kind."
    }
  }
}
