{"envelope_version": "0.1", "kind": "human", "entry_id": "watch-human-checkout-500s", "occurred_at": "2026-09-04T09:12:00Z", "actor": {"subject": "user:corey", "delegation_chain": [{"actor": "user:corey", "obtained_via": "direct"}]}, "intent": {"workflow_ref": "out/unit-free.json", "summary": "Watch the coupon fault unit from my shell while it runs."}, "correlation": {"run_id": "run-watch-free-0001", "correlation_id": "corr-watch-free-0001", "depth": 0}, "budget": {"ceiling_micros": 1500000, "currency": "USD", "on_exceed": "terminate_unit"}, "idempotency_key": "watch-human-checkout-500s-2026-09-04", "payload": {"subject": "POST /checkout/coupon returns 500; traceback ends at pricing/coupon.py line 88.", "watch": {"surface": "stream", "since": 0, "detail": "steps", "redact_additional": [], "sampling": {"head_percent": 100}, "pause_for_decision": false}}}