{
 "envelope_version": "0.1",
 "kind": "schedule",
 "entry_id": "schedule-release-train-20261105",
 "occurred_at": "2026-11-05T07:00:00Z",
 "actor": {
  "subject": "schedule:release-coupon-fix",
  "delegation_chain": [
   {
    "actor": "schedule:release-coupon-fix",
    "obtained_via": "workload_attestation"
   },
   {
    "actor": "user:corey",
    "obtained_via": "token_exchange"
   }
  ]
 },
 "intent": {
  "workflow_ref": "pipelines/release-coupon-fix.json",
  "summary": "The release train fired for its nominal occurrence, catching up after an outage."
 },
 "correlation": {
  "run_id": "run-progress-schedule-0001",
  "correlation_id": "corr-progress-schedule-0001",
  "depth": 0
 },
 "budget": {
  "ceiling_micros": 1500000,
  "currency": "USD",
  "on_exceed": "terminate_unit"
 },
 "idempotency_key": "sched-a71aafbe229d79ec9b976e1c",
 "payload": {
  "source_kind": "a recurrence rule fired",
  "progress": {
   "decision": "none",
   "decider": "user:corey",
   "passes_on_iteration": 2,
   "verify_outcome": "pass",
   "schedule": {
    "unit_ref": "release-coupon-fix",
    "recurrence": "FREQ=WEEKLY;BYDAY=TU,TH;BYHOUR=2;BYMINUTE=0",
    "starts_at": "2026-09-01T02:00:00",
    "timezone": "America/New_York",
    "catch_up": "skip",
    "lookback_days": 14,
    "occurrence": "2026-11-05T07:00:00Z",
    "last_fire_at": "2026-10-27T06:00:00Z",
    "now": "2026-11-05T08:00:00Z"
   }
  }
 }
}