{
  "envelope_version": "0.1",
  "kind": "human",
  "entry_id": "human-ship-coupon-fix",
  "occurred_at": "2026-09-04T09:12:00Z",
  "actor": {
    "subject": "user:corey",
    "delegation_chain": [{"actor": "user:corey", "obtained_via": "direct"}]
  },
  "intent": {
    "workflow_ref": "pipelines/release-coupon-fix.json",
    "summary": "Take the coupon-tier fix from plan to production; I will approve the release myself."
  },
  "correlation": {"run_id": "run-progress-human-0001", "correlation_id": "corr-progress-human-0001", "depth": 0},
  "budget": {"ceiling_micros": 1500000, "currency": "USD", "on_exceed": "terminate_unit"},
  "idempotency_key": "human-ship-coupon-fix-2026-09-04",
  "payload": {
    "source_kind": "typed by a person at a shell",
    "progress": {
      "decision": "approve",
      "decider": "user:corey",
      "passes_on_iteration": 2,
      "verify_outcome": "pass"
    }
  }
}
