{
  "envelope_version": "0.1",
  "kind": "event",
  "entry_id": "event-invoice-paid-inv-882",
  "occurred_at": "2026-09-04T09:12:00Z",
  "actor": {
    "subject": "service:partner-billing",
    "delegation_chain": [
      {"actor": "service:partner-billing", "obtained_via": "workload_attestation"},
      {"actor": "service:intake", "obtained_via": "token_exchange"}
    ]
  },
  "intent": {
    "workflow_ref": "workflows/invoice-paid.json",
    "summary": "Partner billing system reports invoice inv_882 paid by customer cust_17."
  },
  "correlation": {
    "run_id": "run-event-0b10cd7171f6",
    "correlation_id": "corr-event-0b10cd7171f6",
    "depth": 0
  },
  "budget": {"ceiling_micros": 500000, "currency": "USD", "on_exceed": "terminate_unit"},
  "idempotency_key": "invoice-paid-inv_882",
  "payload": {
    "event": "invoice.paid",
    "invoice_id": "inv_882",
    "amount_cents": 12000,
    "currency": "USD",
    "paid_at": "2026-09-04T09:12:00Z",
    "customer": "cust_17",
    "source_kind": "webhook posted by a partner billing system"
  }
}
