{
  "envelope_version": "0.1",
  "kind": "external",
  "entry_id": "steer-external-partner-bot",
  "occurred_at": "2026-09-04T11:30:00Z",
  "actor": {
    "subject": "agent:partner-sre-bot",
    "delegation_chain": [
      {"actor": "agent:partner-sre-bot", "obtained_via": "workload_attestation"},
      {"actor": "service:partner-gateway", "obtained_via": "token_exchange"},
      {"actor": "user:corey", "obtained_via": "token_exchange"}
    ]
  },
  "intent": {
    "workflow_ref": "units/steer-checkout-coupon-fix.json",
    "summary": "A partner agent steers the unit: it rejects the proposal, the retry is rejected too, and the unit escalates once."
  },
  "correlation": {
    "run_id": "run-steer-external-0001",
    "correlation_id": "corr-steer-external-0001",
    "parent_correlation_id": "corr-partner-upstream-0031",
    "depth": 1
  },
  "budget": {"ceiling_micros": 1500000, "currency": "USD", "on_exceed": "terminate_unit"},
  "idempotency_key": "steer-external-partner-bot-2026-09-04",
  "payload": {
    "subject": "partner ticket SRE-4483: coupon rounding fault, deploy must not go out unreviewed",
    "steer": {
      "surface": "stream",
      "decision": "reject",
      "decision_body": {},
      "decision_delay_seconds": 20,
      "intervention": "replace",
      "stall_first_turn": true
    }
  }
}
