{"envelope_version": "0.1", "kind": "human", "entry_id": "human-checkout-500s", "occurred_at": "2026-09-03T09:12:00Z", "actor": {"subject": "user:corey", "delegation_chain": [{"actor": "user:corey", "obtained_via": "direct"}]}, "intent": {"workflow_ref": "workflows/triage-and-fix.json", "summary": "Checkout returns 500 on coupon apply since this morning; find it and fix it."}, "correlation": {"run_id": "run-human-0001", "correlation_id": "corr-human-0001", "depth": 0}, "budget": {"ceiling_micros": 1500000, "currency": "USD", "on_exceed": "terminate_unit"}, "idempotency_key": "short", "payload": {"report_text": "POST /checkout/coupon returns 500. Traceback ends at pricing/coupon.py line 88, KeyError: 'tier'.", "source_kind": "typed by a person in a chat surface", "window_hours": 12}}