{
  "actor": {
    "delegation_chain": [
      {
        "actor": "agent:partner-sre-bot",
        "obtained_via": "workload_attestation"
      },
      {
        "actor": "service:intake",
        "obtained_via": "token_exchange"
      },
      {
        "actor": "user:corey",
        "obtained_via": "direct"
      }
    ],
    "subject": "agent:partner-sre-bot"
  },
  "budget": {
    "ceiling_micros": 1500000,
    "currency": "USD",
    "on_exceed": "terminate_unit"
  },
  "correlation": {
    "correlation_id": "corr-5c3f6081a03e",
    "depth": 1,
    "parent_correlation_id": "corr-partner-77c1",
    "run_id": "run-5c3f6081a03e"
  },
  "entry_id": "external-aee701745ee9",
  "envelope_version": "0.1",
  "idempotency_key": "external-a91765b31e5b",
  "intent": {
    "summary": "Checkout returns 500 on coupon apply since this morning; find it and fix it.",
    "workflow_ref": "workflows/triage-and-fix.json"
  },
  "kind": "external",
  "occurred_at": "2026-09-04T09:20:15Z",
  "payload": {
    "report_text": "POST /checkout/coupon returns 500. Traceback ends at pricing/coupon.py line 88, KeyError: 'tier'.",
    "window_hours": 12
  }
}
