{
  "envelope_version": "0.1",
  "kind": "schedule",
  "entry_id": "run-schedule-nightly-fault-sweep",
  "occurred_at": "2026-09-03T02:00:00Z",
  "actor": {
    "subject": "schedule:nightly-fault-sweep",
    "delegation_chain": [
      {
        "actor": "schedule:nightly-fault-sweep",
        "obtained_via": "workload_attestation"
      },
      {
        "actor": "user:corey",
        "obtained_via": "token_exchange"
      }
    ]
  },
  "intent": {
    "workflow_ref": "units/fix-checkout-coupon-500s.json",
    "summary": "Nightly sweep: run one contained unit per unresolved fault of the last day."
  },
  "correlation": {
    "run_id": "run-run-schedule-0001",
    "correlation_id": "corr-run-schedule-0001",
    "depth": 0
  },
  "budget": {
    "ceiling_micros": 120000,
    "currency": "USD",
    "on_exceed": "terminate_unit"
  },
  "idempotency_key": "run-nightly-fault-sweep-2026-09-03",
  "payload": {
    "recurrence": "FREQ=DAILY;BYHOUR=2;BYMINUTE=0",
    "report_text": "Top unresolved fault of 2026-09-02: pricing/coupon.py KeyError: 'tier' on /checkout/coupon, 431 occurrences.",
    "source_kind": "recurrence rule fired",
    "fleet_size": 50
  }
}
