{
  "envelope_version": "0.1",
  "kind": "event",
  "entry_id": "event-alert-checkout-500s",
  "occurred_at": "2026-09-03T09:07:41Z",
  "actor": {
    "subject": "service:alerting",
    "delegation_chain": [
      {"actor": "service:alerting", "obtained_via": "workload_attestation"},
      {"actor": "service:intake", "obtained_via": "token_exchange"}
    ]
  },
  "intent": {
    "workflow_ref": "workflows/triage-and-fix.json",
    "summary": "Error-rate alert on the checkout service crossed threshold."
  },
  "correlation": {"run_id": "run-event-0001", "correlation_id": "corr-event-0001", "depth": 0},
  "budget": {"ceiling_micros": 1500000, "currency": "USD", "on_exceed": "terminate_unit"},
  "idempotency_key": "alert-8f31c0-checkout-500s",
  "payload": {
    "report_text": "alert=http_5xx_rate service=checkout route=/checkout/coupon value=0.11 threshold=0.02 sample_trace ends at pricing/coupon.py line 88 KeyError: 'tier'.",
    "source_kind": "structured event from an internal producer",
    "window_hours": 12
  }
}
