{
  "envelope_version": "0.1",
  "kind": "schedule",
  "entry_id": "schedule-nightly-fault-sweep",
  "occurred_at": "2026-09-03T02:00:00Z",
  "actor": {
    "subject": "schedule:nightly-fault-sweep",
    "delegation_chain": [
      {"actor": "schedule:nightly-fault-sweep", "obtained_via": "workload_attestation"},
      {"actor": "user:corey", "obtained_via": "token_exchange"}
    ]
  },
  "intent": {
    "workflow_ref": "workflows/triage-and-fix.json",
    "summary": "Nightly sweep: take the top unresolved fault of the last day through triage and fix."
  },
  "correlation": {"run_id": "run-schedule-0001", "correlation_id": "corr-schedule-0001", "depth": 0},
  "budget": {"ceiling_micros": 1500000, "currency": "USD", "on_exceed": "terminate_unit"},
  "idempotency_key": "nightly-fault-sweep-2026-09-03",
  "payload": {
    "recurrence": "FREQ=DAILY;BYHOUR=2;BYMINUTE=0",
    "report_text": "Top unresolved fault of 2026-09-02: pricing/coupon.py line 88 KeyError: 'tier' on /checkout/coupon, 431 occurrences.",
    "source_kind": "recurrence rule fired",
    "window_hours": 24
  }
}
